ID,Area,Interaction,Zen_Behavior,Zen_Ref,UX_Spec_Ref,XBrowser_Current,XBrowser_Task,Suggested_Files,DependsOn,Priority,Milestone,Status,Done_Criteria,Test_Steps
META-INT-V2-001,Meta,本CSV用于追踪「打不开/系统错误/层级遮挡/运行方式」等稳定性与开发体验问题，优先把应用做到“随时可运行、问题可定位”。,Zen整体体验=可预期+低打扰：出问题要能自解释并给出下一步。,,docs/UX_SPEC.md,此前存在：QML语法错误导致无法启动；WebView2/Qt运行时缺失时提示不清；WebView2 HWND 会遮挡 QML Popup。,建立稳定性/层级/部署/运行的闭环，并用可验收的 Done_Criteria 标记完成。,reference/logs/zen_browser_interaction_plan_v2.csv,,META,M0,done,团队对齐：后续稳定性问题都落到本表并可验收。,打开CSV检查字段齐全且任务可落地
INT-V2-001,Startup,QML加载失败时可定位且不阻塞主流程,Zen遇到异常时不会“黑屏无反馈”，会有明确提示/日志线索。,,docs/UX_SPEC.md,曾出现 BrowserWindow.qml 语法错误/重复 id 导致 Main.qml 加载失败。,修复QML语法/重复id类问题，保证至少能启动到主界面并输出可用日志。,ui/qml/BrowserWindow.qml; ui/ui.qrc,,P0,M1,done,应用可启动且日志不再出现“QQmlApplicationEngine failed to load component”。,构建 Debug -> 启动 -> 检查 %LOCALAPPDATA%\\XBrowser\\XBrowser\\xbrowser.log
INT-V2-002,Layering,WebView2 HWND 上方弹出层不被遮挡（侧边栏右键/网页右键/权限提示/Overlay/Toast）,Zen弹出层总能覆盖页面内容。,reference/zen-browser-src/desktop-dev/src/zen/common/modules/ZenUIManager.mjs,docs/UX_SPEC.md,WebView2(HWND) 会压在 QtQuick.Popup/Popup 之上，导致菜单被盖住。,将关键弹出层改为顶层 Window 承载（PopupManager/OverlayHost/ToastHost），并统一右键菜单实现。,ui/qml/components/PopupManager.qml; ui/qml/components/OverlayHost.qml; ui/qml/components/ToastHost.qml; ui/qml/components/ContextMenu.qml; ui/qml/BrowserWindow.qml,,P0,M1,done,在网页区域与侧边栏区域右键菜单均可见且可点击；Overlay/Toast 不被遮挡。,打开任意网页 -> 右键；侧边栏 tab 右键；触发 toast/overlay
INT-V2-003,WebView2,缺少 WebView2 Runtime 时给出明确可操作提示,Zen内核不可用时也有清晰引导。,,docs/UX_SPEC.md,此前缺少 runtime 时只表现为“系统找不到文件”且页面区域空白。,在 WebView2 初始化失败时暴露 initError 并在页面内显示“安装/重试”引导。,src/engine/webview2/WebView2View.*; ui/qml/BrowserWindow.qml,,P0,M1,done,缺少 runtime 时页面出现提示并提供安装链接；有 runtime 时不影响正常使用。,卸载/隔离 WebView2 Runtime 后启动 -> 看到提示 -> 点击安装链接
INT-V2-004,Packaging,运行时缺少 Qt 动态库/平台插件的问题一劳永逸,Zen分发形态=开箱即用。,,docs/BUILDING.md,此前 Debug/Release 环境下偶发 Qt DLL/平台插件缺失。,构建后自动运行 windeployqt 并生成/复制 qt.conf，使 build\\<Config>\\xbrowser.exe 可直接双击运行。,src/CMakeLists.txt; cmake/qt.conf; scripts/deploy.ps1,,P0,M1,done,构建完成后 build\\Debug\\xbrowser.exe 可直接运行且不依赖 PATH；qt.conf 存在。,cmake --build build --config Debug -> 双击/运行 build\\Debug\\xbrowser.exe
INT-V2-005,DX,提供多种“打开浏览器”方式并保持一致,Zen开发体验=路径清晰、可复现。,,README.md; docs/BUILDING.md,此前运行方式分散且遇到缺依赖难定位。,补充脚本与文档：run/deploy 脚本优先使用已部署运行时，并提供 VS/CMake/脚本多入口。,scripts/run.ps1; scripts/run.cmd; scripts/deploy.ps1; scripts/deploy.cmd; README.md,,P1,M1,done,至少提供 3 种可复现的启动方式，并在 README 给出推荐流程。,按 README 的 3 种方式分别启动一次

