ID,Area,Interaction,Zen_Behavior,Zen_Ref,UX_Spec_Ref,XBrowser_Current,XBrowser_Task,Suggested_Files,DependsOn,Priority,Milestone,Status,Done_Criteria,Test_Steps
META-NEXT-V5-001,Meta,本CSV用于追踪「Zen差距补齐：核心浏览能力/数据控制/高级管理/自定义」的下一阶段迭代,Zen 体验=路径短+状态可预期+弹层不被遮挡+基础浏览能力完整（缩放/全屏/清理数据/书签导入导出/下载管理）, ,docs/UX_SPEC.md,当前 merged_developing 为空且需要新的可执行任务队列,建立 NEXT-V5-* 任务拆解并确保每行可验收+可回归；实现后把 Status 从 todo 改为 done,reference/developing/zen_browser_next_plan_v5.csv, ,META,M15,done,本表可作为连续 12h 执行的任务队列且字段齐全,打开 CSV 抽查 10 行均有 Done_Criteria 与 Test_Steps
NEXT-V5-001,WebView2,基础缩放：Ctrl+±/0 与菜单项,Zen/主流浏览器支持 Ctrl+±/0 调整缩放且立刻生效并可重置, ,docs/UX_SPEC.md,当前未暴露 WebView2 ZoomFactor 且无快捷键,WebView2View 增加 zoomFactor Q_PROPERTY 与 zoomIn/zoomOut/zoomReset；BrowserWindow 增加 Zoom In/Out/Reset 命令与菜单/快捷键并驱动 focusedView,src/engine/webview2/WebView2View.*; ui/qml/BrowserWindow.qml; src/core/ShortcutStore.*, ,P0,M15,done,打开网页后 Ctrl+Plus/Ctrl+Minus/Ctrl+0 会改变网页缩放且不会崩溃,打开任意网页->按 Ctrl+Plus 两次->按 Ctrl+Minus 一次->按 Ctrl+0 重置；cmake --build build --config Debug；cd build；ctest -C Debug --output-on-failure
NEXT-V5-002,Urlbar,缩放指示器：显示百分比并一键重置,Zen 的缩放状态可见且可快速重置避免用户迷失, ,docs/UX_SPEC.md,当前缩放不可见,在地址栏右侧增加 ZoomIndicator（例如 110%）；点击重置；hover 显示 tooltip；reduceMotion 下不做复杂动画,ui/qml/BrowserWindow.qml; ui/qml/components/PopupManager.qml,NEXT-V5-001,P1,M15,done,缩放改变时指示器更新且点击可重置到 100%,打开网页->Ctrl+Plus 到 125%->观察指示器显示->点击指示器->回到 100%；cmake --build build --config Debug；cd build；ctest -C Debug --output-on-failure
NEXT-V5-003,Settings,缩放设置：默认缩放+按站点记忆开关,Zen 可配置偏好并让缩放状态可预期, ,docs/UX_SPEC.md,当前无缩放配置与持久化,AppSettings 增加 defaultZoom 与 rememberZoomPerSite；提供每站点 zoomMap 持久化；SettingsDialog 增加对应 UI,src/core/AppSettings.*; ui/qml/components/SettingsDialog.qml; tests/TestAppSettings.cpp,NEXT-V5-001,P1,M15,done,修改默认缩放后新打开的网页使用该缩放且开关可持久化,打开 Settings->Appearance->修改默认缩放为 110%->新建标签打开网页->默认 110%；重启后设置保持；cmake --build build --config Debug；cd build；ctest -C Debug --output-on-failure
NEXT-V5-004,WebView2,按站点缩放：同域名复用上次缩放,Zen/Arc 类体验：同一个站点缩放保持一致跨 tab, ,docs/UX_SPEC.md,当前缩放不持久且无法按站点应用,导航提交时读取 host；若 rememberZoomPerSite 开启则应用 zoomMap[host] 否则应用 defaultZoom；在用户触发 zoom 时写回 zoomMap,src/engine/webview2/WebView2View.*; src/core/AppSettings.*; ui/qml/BrowserWindow.qml,NEXT-V5-003,P0,M15,done,两个同域网页保持一致缩放且重启后仍按预期应用,开启按站点记忆->打开 https://example.com 缩放到 125%->新建标签再打开同域->自动 125%->重启后仍 125%；cmake --build build --config Debug；cd build；ctest -C Debug --output-on-failure
NEXT-V5-005,Navigation,停止加载：Esc/按钮可 stop 并与 reload 状态互斥,Zen/主流浏览器加载中显示停止按钮且 Esc 可中止加载, ,docs/UX_SPEC.md,reload 按钮仅显示加载中动效但无法 stop,WebView2View 增加 stop()；BrowserWindow 增加 nav-stop 命令与 Esc 快捷键；加载中将 reloadButton 行为切换为 stop 并显示合适图标,src/engine/webview2/WebView2View.*; ui/qml/BrowserWindow.qml; src/core/ShortcutStore.*, ,P1,M15,done,访问慢站点时点击按钮或按 Esc 可停止加载且 isLoading 变为 false,打开一个加载较慢页面->看到加载状态->按 Esc 或点击 stop->加载停止；cmake --build build --config Debug；cd build；ctest -C Debug --output-on-failure
NEXT-V5-006,Menus,打开本地文件：Ctrl+O 选择 html 并在当前标签打开,Zen/主流浏览器支持 Ctrl+O 打开本地文件并可继续导航, ,docs/UX_SPEC.md,当前无 Open File 入口,增加 Open File 命令与快捷键 Ctrl+O；使用 FileDialog 选择文件并导航到 file:///；支持打开图片与 html；失败 toast,ui/qml/BrowserWindow.qml; ui/qml/components/Shortcuts.qml; ui/qml/components/ToastHost.qml, ,P2,M15,done,选择本地 html 后能在 WebView2 中渲染且地址栏显示 file URL,菜单 File->Open File 或 Ctrl+O->选择一个本地 html->页面渲染；cmake --build build --config Debug；cd build；ctest -C Debug --output-on-failure
NEXT-V5-007,Window/Layout,全屏：F11 切换窗口全屏并隐藏无关 UI,Zen F11 全屏；Esc 退出；全屏时布局更专注, ,docs/UX_SPEC.md,当前无全屏切换,增加 toggle-fullscreen 命令与 F11；QML 设置 Window.visibility=FullScreen；全屏时隐藏标题区/侧栏可选并保持退出还原,ui/qml/BrowserWindow.qml; src/core/ShortcutStore.*; src/platform/windows/WindowChromeController.* (if needed), ,P1,M15,done,F11 可进出全屏且退出后 UI 状态还原,打开网页->按 F11 进入全屏->按 Esc 或 F11 退出->确认侧栏与地址栏状态一致；cmake --build build --config Debug；cd build；ctest -C Debug --output-on-failure
NEXT-V5-008,WebView2,Web 内容触发全屏（视频）与窗口全屏联动,网页 video 全屏会驱动浏览器进入内容全屏并可一键退出, ,docs/UX_SPEC.md,当前可能忽略 ContainsFullScreenElementChanged,监听 WebView2 ContainsFullScreenElementChanged；当网页进入全屏时切换窗口全屏并展示退出提示；退出时恢复,src/engine/webview2/WebView2View.*; ui/qml/BrowserWindow.qml; ui/qml/components/ToastHost.qml,NEXT-V5-007,P2,M15,todo,视频站点进入全屏后窗口进入全屏且退出后恢复,打开视频站点->点击播放器全屏->窗口进入全屏->按 Esc 退出->窗口恢复；cmake --build build --config Debug；cd build；ctest -C Debug --output-on-failure
NEXT-V5-009,Output,查看页面源代码：菜单/右键打开 SourceViewer,Zen 右键可查看源代码并在新标签展示, ,docs/UX_SPEC.md,当前无 View Source 能力,增加 view-source 命令；通过 ExecuteScript 获取 outerHTML 并打开内部 SourceViewer 页面展示；支持复制与查找,src/engine/webview2/WebView2View.*; ui/qml/BrowserWindow.qml; ui/qml/components/FindBar.qml; ui/qml/components/ContextMenu.qml; ui/qml/components/OverlayHost.qml, ,P2,M15,todo,可在新标签看到当前页面 HTML 文本且可复制,打开网页->右键->View Source->出现新标签显示 HTML->Ctrl+F 查找->Ctrl+A 复制；cmake --build build --config Debug；cd build；ctest -C Debug --output-on-failure
NEXT-V5-010,Output,SourceViewer 细节：语法高亮与大文件性能,查看源代码在大页面下也不卡且易读, ,docs/UX_SPEC.md,SourceViewer 尚无高亮与行号（待实现）,SourceViewer 增加行号与基础高亮（HTML tag/attr）；对大文本使用延迟渲染或分页；支持保存到文件,ui/qml/components/SourceViewer.qml (new); ui/qml/BrowserWindow.qml,NEXT-V5-009,P3,M15,todo,打开大型页面源代码时滚动与搜索仍流畅且可另存为,打开较大网页->View Source->快速滚动与 Ctrl+F->无明显卡顿；点击 Save->生成文件；cmake --build build --config Debug；cd build；ctest -C Debug --output-on-failure
NEXT-V5-011,Core,缩放配置单测：序列化与回读,关键配置需可回归避免升级后缩放丢失, ,docs/UX_SPEC.md,TestAppSettings 未覆盖缩放相关字段,扩展 TestAppSettings 覆盖 defaultZoom/rememberZoomPerSite/zoomMap 的保存与回读并校验边界值,tests/TestAppSettings.cpp; src/core/AppSettings.*,NEXT-V5-003,P2,M15,done,ctest 覆盖新增用例且通过,cmake --build build --config Debug；cd build；ctest -C Debug --output-on-failure
NEXT-V5-012,Meta/Process,模块验收与归档(M15 Core Browsing),每个模块完成后有可回归测试并刷新 merged, ,docs/UX_SPEC.md,M15 任务尚未归档,完成 NEXT-V5-001..011 后把对应 Status 置为 done；运行合并脚本刷新 merged CSV,reference/developing/zen_browser_next_plan_v5.csv; scripts/merge_plans.ps1,NEXT-V5-001,P0,M15,done,merged_developing 中不再包含 NEXT-V5-001..012 且 counts 更新,修改 Status->done；运行 powershell -NoProfile -ExecutionPolicy Bypass -File scripts/merge_plans.ps1 -IncludeLayout；检查 reference/zen_browser_merged_developing.csv
NEXT-V5-013,Privacy,清理浏览数据对话框（时间范围+类型）,Zen/主流浏览器提供 Clear browsing data 并支持时间范围与多类型清理, ,docs/UX_SPEC.md,当前缺少统一清理入口,在 Settings->Privacy 增加 ClearDataDialog：选择时间范围（1h/24h/7d/all）与类型（历史/cookies/cache/downloads/permissions）；确认后触发清理并 toast,ui/qml/components/SettingsDialog.qml; ui/qml/components/ClearDataDialog.qml (new); ui/qml/BrowserWindow.qml, ,P0,M16,todo,可从设置打开清理对话框并执行清理流程,访问3个站点->打开清理对话框->选择清理历史(all)->确认->HistoryPanel 为空；cmake --build build --config Debug；cd build；ctest -C Debug --output-on-failure
NEXT-V5-014,WebView2,清理 WebView2 缓存与 cookies（API 接入）,清理应覆盖 WebView2 profile 的缓存/cookies 等真实数据, ,docs/UX_SPEC.md,当前未接入 ClearBrowsingDataAsync,"在 WebView2View/BrowserController 增加 clearBrowsingData(kindMask,timeRange)；调用 WebView2 Profile ClearBrowsingDataAsync；暴露给 QML 并与 ClearDataDialog 串联",src/engine/webview2/WebView2View.*; src/core/BrowserController.*; ui/qml/BrowserWindow.qml,NEXT-V5-013,P0,M16,todo,清理 cookies 后重新打开站点不再处于登录态（最小可验收）,登录一个测试站点或设置 cookie->执行清理 cookies->刷新->登录态消失；cmake --build build --config Debug；cd build；ctest -C Debug --output-on-failure
NEXT-V5-015,Data,清理本地数据：History/Downloads/Permissions 统一清理,清理对话框除内核数据外还应清理本地 store 并保持一致, ,docs/UX_SPEC.md,各 store 独立且缺少统一清理 API,HistoryStore 增加 clearRange；DownloadModel 增加 clearAll/clearCompleted；SitePermissionsStore 增加 resetAll；ClearDataDialog 根据选项调用对应 API,src/core/HistoryStore.*; src/core/DownloadModel.*; src/core/SitePermissionsStore.*; ui/qml/components/ClearDataDialog.qml,NEXT-V5-013,P1,M16,todo,选择清理历史/下载/权限后对应面板立即为空且重启不恢复,产生历史+下载+权限记录->清理所选类型->打开面板确认为空->重启确认仍为空；cmake --build build --config Debug；cd build；ctest -C Debug --output-on-failure
NEXT-V5-016,WebView2,Cookie 管理：列出当前站点 cookies 并可逐条删除,Zen Site Data 面板可查看并清理 cookies, ,docs/UX_SPEC.md,当前无 cookie 列表能力,"封装 WebView2 CookieManager：getCookies(url) 返回简化列表；deleteCookie(domain,name,path)；提供 QAbstractListModel 暴露给 QML",src/engine/webview2/WebView2CookieModel.* (new); src/engine/webview2/WebView2View.*; src/app/main.cpp, ,P1,M16,todo,在 QML 中可显示 cookies 列表并能删除一条使其消失,访问会写 cookie 的站点->打开 Site Data->看到 cookies->删除一条->刷新->该 cookie 不再出现；cmake --build build --config Debug；cd build；ctest -C Debug --output-on-failure
NEXT-V5-017,SiteDataPanel,Site Data 面板：cookies 列表+一键清理当前站点,Zen Site Data 面板入口短且不遮挡页面, ,docs/UX_SPEC.md,当前无站点数据面板或信息不足,新增 SiteDataPanel：展示 cookie 列表与删除按钮；一键清理当前站点 cookies；与 PopupManager/OverlayHost 正确 layering,ui/qml/components/SiteDataPanel.qml (new); ui/qml/BrowserWindow.qml; ui/qml/components/PopupManager.qml; src/engine/webview2/WebView2CookieModel.* (new),NEXT-V5-016,P1,M16,todo,从地址栏站点图标可打开 Site Data 面板并完成清理,打开站点->点击站点信息->进入 Site Data->清理 cookies->刷新->登录态消失或 cookie 为空；cmake --build build --config Debug；cd build；ctest -C Debug --output-on-failure
NEXT-V5-018,SiteInfo,站点信息面板：安全状态+快捷入口（权限/站点数据）,Zen 点击锁形图标打开站点信息面板并管理权限/站点数据, ,docs/UX_SPEC.md,当前站点信息入口不完整或信息不足,增加 SiteInfoPanel：展示 scheme/host/安全提示；提供按钮打开 PermissionsPanel 与 SiteDataPanel；确保弹层不遮挡,ui/qml/components/SiteInfoPanel.qml (new); ui/qml/BrowserWindow.qml; ui/qml/components/PopupManager.qml,NEXT-V5-017,P1,M16,todo,点击地址栏左侧图标可打开面板并跳转到权限/站点数据,打开 https 站点->点击锁图标->显示 host 与安全提示->点击 Permissions/Site Data 按钮->对应面板打开；cmake --build build --config Debug；cd build；ctest -C Debug --output-on-failure
NEXT-V5-019,Permissions,权限中心增强：按类型过滤+搜索+一键重置,权限管理需要可查询与批量重置, ,docs/UX_SPEC.md,PermissionsCenter 仅列表与重置能力有限,PermissionsCenter 增加类型过滤（通知/摄像头/麦克风等）；搜索；一键重置全部站点；显示统计,ui/qml/components/PermissionsCenter.qml; src/core/SitePermissionsStore.*, ,P2,M16,todo,可按类型筛选且一键重置后列表为空,触发2种权限记录->打开权限中心->按类型筛选->重置全部->列表为空；cmake --build build --config Debug；cd build；ctest -C Debug --output-on-failure
NEXT-V5-020,Data,清理相关单测：History clearRange 与 Permissions resetAll,数据清理是高风险路径必须有回归测试, ,docs/UX_SPEC.md,现有单测未覆盖批量清理 API,扩展 TestHistoryStore/TestSitePermissionsStore 覆盖 clearRange/resetAll 与时间边界；确保 ctest 通过,tests/TestHistoryStore.cpp; tests/TestSitePermissionsStore.cpp; src/core/HistoryStore.*; src/core/SitePermissionsStore.*,NEXT-V5-015,P1,M16,todo,新增用例覆盖且 ctest 通过,cmake --build build --config Debug；cd build；ctest -C Debug --output-on-failure
NEXT-V5-021,Meta/Process,模块验收与归档(M16 Privacy/Data Control),每个模块完成后必须可回归测试并刷新汇总, ,docs/UX_SPEC.md,M16 任务尚未归档,完成 NEXT-V5-013..020 后把 Status 置为 done；运行合并脚本刷新 merged CSV,reference/developing/zen_browser_next_plan_v5.csv; scripts/merge_plans.ps1,NEXT-V5-013,P0,M16,todo,merged_developing 中不再包含 NEXT-V5-013..021 且 areas/counts 更新,修改 Status->done；运行 powershell -NoProfile -ExecutionPolicy Bypass -File scripts/merge_plans.ps1 -IncludeLayout；检查 reference/zen_browser_merged_counts_by_area.csv
NEXT-V5-022,Data,书签：引入文件夹层级与排序,Zen 书签支持文件夹与拖拽排序且跨重启保持, ,docs/UX_SPEC.md,BookmarksStore 仅支持扁平列表（无 folder）,扩展 BookmarksStore schema：itemType(bookmark/folder)；parentId；order；提供 createFolder/rename/move/reorder；迁移旧数据,src/core/BookmarksStore.*; src/core/BookmarksFilterModel.*; tests/TestBookmarksStore.cpp, ,P0,M17,todo,可创建文件夹并把书签移动进去且重启后结构保持,收藏2个书签->创建文件夹->移动其中一个->重启->结构保持；cmake --build build --config Debug；cd build；ctest -C Debug --output-on-failure
NEXT-V5-023,Panels/Web,书签面板：树状视图与文件夹管理,书签管理路径短且支持展开/折叠文件夹, ,docs/UX_SPEC.md,BookmarksPanel 为简单列表（无树）,BookmarksPanel 改为 TreeView/嵌套 ListView；支持展开折叠；右键菜单：新建文件夹/重命名/删除/在新标签打开全部,ui/qml/components/BookmarksPanel.qml; ui/qml/components/ContextMenu.qml; ui/qml/components/PopupManager.qml,NEXT-V5-022,P1,M17,todo,文件夹可展开折叠且菜单操作生效不被裁剪,打开书签面板->创建文件夹->展开/折叠->右键重命名->删除；cmake --build build --config Debug；cd build；ctest -C Debug --output-on-failure
NEXT-V5-024,DnD,书签拖拽：排序与移动到文件夹,Zen 支持拖拽调整书签顺序与归档到文件夹, ,docs/UX_SPEC.md,书签列表不支持拖拽,BookmarksPanel 增加 Drag/Drop：同级 reorder；拖到 folder 进入；拖出返回根；更新 BookmarksStore 并持久化,ui/qml/components/BookmarksPanel.qml; src/core/BookmarksStore.*,NEXT-V5-022,P1,M17,todo,拖拽可改变顺序与父文件夹且重启后保持,新建3个书签->拖拽调整顺序->拖到文件夹->重启->顺序与层级保持；cmake --build build --config Debug；cd build；ctest -C Debug --output-on-failure
NEXT-V5-025,Data,书签导入导出：HTML（Netscape Bookmark File）,主流浏览器支持从 HTML 导入导出书签便于迁移, ,docs/UX_SPEC.md,无导入导出能力,BookmarksStore 实现 exportToHtml/importFromHtml；支持 folder；解析常见 HTML；单测覆盖 roundtrip 与错误处理,src/core/BookmarksStore.*; tests/TestBookmarksStore.cpp,NEXT-V5-022,P2,M17,todo,TestBookmarksStore 覆盖 import/export roundtrip 且 ctest 通过,cmake --build build --config Debug；cd build；ctest -C Debug --output-on-failure
NEXT-V5-026,Settings,书签导入导出入口：Settings/Bookmarks,迁移路径短：导入导出入口在书签或设置内, ,docs/UX_SPEC.md,无 UI 入口,在 SettingsDialog 增加 Bookmarks 区块：Import/Export 按钮；使用 FileDialog 选择路径；展示错误 toast,ui/qml/components/SettingsDialog.qml; ui/qml/components/BookmarksPanel.qml; ui/qml/BrowserWindow.qml,NEXT-V5-025,P2,M17,todo,可从设置导入导出并在 UI 中看到变化,打开 Settings->Bookmarks->Export->生成文件；删除一个书签->Import->书签恢复；cmake --build build --config Debug；cd build；ctest -C Debug --output-on-failure
NEXT-V5-027,Data,书签单测：folder/move/import/export,数据层需可回归避免重构回归, ,docs/UX_SPEC.md,TestBookmarksStore 覆盖不足,扩展 TestBookmarksStore 覆盖：folder create/rename/move；reorder；HTML import/export；错误场景,tests/TestBookmarksStore.cpp; src/core/BookmarksStore.*,NEXT-V5-025,P1,M17,todo,新增用例覆盖且 ctest 通过,cmake --build build --config Debug；cd build；ctest -C Debug --output-on-failure
NEXT-V5-028,Data,历史：按域名/时间过滤与导出 CSV,历史管理需要搜索过滤与可导出便于诊断迁移, ,docs/UX_SPEC.md,HistoryStore 缺少导出与批量删除,"HistoryStore 增加 query(domain,range,limit)；exportToCsv(path,range)；支持删除单条与按域名批量删除",src/core/HistoryStore.*; tests/TestHistoryStore.cpp, ,P1,M17,todo,可导出 CSV 且包含 title/url/time 且删除 API 生效,运行单测覆盖导出与删除；手动访问3站点后在 HistoryPanel 验证删除生效；cmake --build build --config Debug；cd build；ctest -C Debug --output-on-failure
NEXT-V5-029,Panels/Web,历史面板：搜索+分组+右键删除/复制,Zen 历史按天分组且可快速搜索与清理, ,docs/UX_SPEC.md,HistoryPanel 仅支持简单列表与清理能力有限,HistoryPanel 增加搜索框；按天分组；条目右键菜单：Open/Copy URL/Delete；支持多选批量删除,ui/qml/components/HistoryPanel.qml; ui/qml/components/ContextMenu.qml; src/core/HistoryFilterModel.*,NEXT-V5-028,P1,M17,todo,搜索可过滤并可删除单条/多条且 UI 不被裁剪,产生历史记录->打开历史面板->搜索关键字->右键删除一条->刷新页面->该条不再出现；cmake --build build --config Debug；cd build；ctest -C Debug --output-on-failure
NEXT-V5-030,Data,历史单测：query/export/delete,历史是核心数据必须可回归, ,docs/UX_SPEC.md,TestHistoryStore 未覆盖导出与批量删除,扩展 TestHistoryStore：覆盖 query domain/range；exportToCsv 输出内容；deleteByDomain 与 deleteEntry,tests/TestHistoryStore.cpp; src/core/HistoryStore.*,NEXT-V5-028,P1,M17,todo,ctest 覆盖新增用例且通过,cmake --build build --config Debug；cd build；ctest -C Debug --output-on-failure
NEXT-V5-031,Meta/Process,模块验收与归档(M17 Bookmarks/History Pro),模块完成后刷新汇总与统计, ,docs/UX_SPEC.md,M17 任务尚未归档,完成 NEXT-V5-022..030 后把 Status 置为 done；运行合并脚本刷新 merged CSV,reference/developing/zen_browser_next_plan_v5.csv; scripts/merge_plans.ps1,NEXT-V5-022,P0,M17,todo,merged_developing 中不再包含 NEXT-V5-022..031 且 areas/counts 更新,修改 Status->done；运行 powershell -NoProfile -ExecutionPolicy Bypass -File scripts/merge_plans.ps1 -IncludeLayout；检查 reference/zen_browser_merged_developed.csv
NEXT-V5-032,Downloads,下载持久化：跨重启保留列表与状态,主流浏览器下载列表可跨会话查看并支持打开位置, ,docs/UX_SPEC.md,DownloadModel 仅内存态且重启丢失,设计 downloads.json schema（id/url/path/state/bytes/finishedAt）；DownloadModel load/save；预留 version 便于迁移,src/core/DownloadModel.*; src/core/AppPaths.*; tests/TestDownloadModel.cpp, ,P1,M18,todo,重启后下载列表仍在且已完成项状态正确,完成一个下载->关闭/重启->打开下载面板->仍可见且可 open folder；cmake --build build --config Debug；cd build；ctest -C Debug --output-on-failure
NEXT-V5-033,Downloads,下载面板增强：分组/搜索/批量清理,下载管理路径短：完成/进行中分组且可快速清理, ,docs/UX_SPEC.md,DownloadsDialog 信息密度与操作不足,DownloadsDialog 增加分组（In progress/Completed/Failed）；搜索；批量清理 completed；显示速度/ETA（可选）,ui/qml/components/DownloadsDialog.qml; src/core/DownloadModel.*,NEXT-V5-032,P2,M18,todo,可搜索下载项并一键清理 completed 且不影响进行中,产生>=3条下载（至少1完成）->打开下载面板->搜索->清理 completed->仅进行中保留；cmake --build build --config Debug；cd build；ctest -C Debug --output-on-failure
NEXT-V5-034,Downloads,下载动作补齐：Pause/Resume/Cancel/Open/Open Folder/Copy URL,Zen 下载项动作齐全且不需要额外页面, ,docs/UX_SPEC.md,下载项动作不完整,DownloadModel 增加对应 invokable；DownloadsDialog 增加按钮与右键菜单；失败显示原因与重试,src/core/DownloadModel.*; ui/qml/components/DownloadsDialog.qml; ui/qml/components/ContextMenu.qml,NEXT-V5-032,P1,M18,todo,下载项可暂停/继续/取消且 Open/Open Folder 可用,开始一个大文件下载->暂停->继续->完成->Open Folder；cmake --build build --config Debug；cd build；ctest -C Debug --output-on-failure
NEXT-V5-035,Toast,下载通知：开始/完成/失败 toast 与工具栏 badge,下载完成提示不阻塞并可一键打开文件夹, ,docs/UX_SPEC.md,缺少明确下载通知,badge 显示进行中数量；完成 toast 提供 Open Folder；失败 toast 提供 Retry；确保 overlay 不遮挡,ui/qml/BrowserWindow.qml; ui/qml/components/ToastHost.qml; src/core/DownloadModel.*,NEXT-V5-032,P2,M18,todo,下载完成时出现 toast 且点击可打开文件夹,完成一个下载->出现 toast->点击 Open Folder->资源管理器打开；cmake --build build --config Debug；cd build；ctest -C Debug --output-on-failure
NEXT-V5-036,NativeUtils,打开文件/文件夹：统一 ShellExecute 封装,打开下载文件与目录应稳定且路径带空格可用, ,docs/UX_SPEC.md,打开路径逻辑分散且错误处理不一致,新增 NativeUtils.openPath/openFolder；Downloads/Bookmarks/Diagnostics 复用；处理错误 toast,src/platform/windows/NativeUtils.* (new); src/app/main.cpp; ui/qml/BrowserWindow.qml, ,P3,M18,todo,openPath/openFolder 在路径含空格时可用且失败有提示,用含空格的临时目录下载文件->Open Folder->成功；将路径设为不存在->提示错误；cmake --build build --config Debug；cd build；ctest -C Debug --output-on-failure
NEXT-V5-037,Downloads,下载持久化单测与回归,下载数据是用户资产必须可回归, ,docs/UX_SPEC.md,TestDownloadModel 未覆盖 save/load,扩展 TestDownloadModel 覆盖：保存后回读；completed/failed 状态；清理 completed；schema version,tests/TestDownloadModel.cpp; src/core/DownloadModel.*,NEXT-V5-032,P1,M18,todo,ctest 覆盖新增用例且通过,cmake --build build --config Debug；cd build；ctest -C Debug --output-on-failure
NEXT-V5-038,Meta/Process,模块验收与归档(M18 Downloads Pro),模块完成后刷新汇总, ,docs/UX_SPEC.md,M18 任务尚未归档,完成 NEXT-V5-032..037 后把 Status 置为 done；运行合并脚本刷新 merged CSV,reference/developing/zen_browser_next_plan_v5.csv; scripts/merge_plans.ps1,NEXT-V5-032,P0,M18,todo,merged_developing 中不再包含 NEXT-V5-032..038 且 counts 更新,修改 Status->done；运行 powershell -NoProfile -ExecutionPolicy Bypass -File scripts/merge_plans.ps1 -IncludeLayout；检查 reference/zen_browser_merged_counts_by_area.csv
NEXT-V5-039,Tabs,Tab Group 折叠/展开并持久化,Zen 的 group/folder 可折叠减少噪音且状态可预期, ,docs/UX_SPEC.md,TabGroupModel 无折叠状态,TabGroupModel 增加 collapsed 字段与 setCollapsed；SessionStore 保存/恢复；侧栏 group header 点击切换,src/core/TabGroupModel.*; src/core/SessionStore.*; ui/qml/BrowserWindow.qml; tests/TestSessionStore.cpp, ,P1,M19,todo,折叠后组内 tab 隐藏且重启后折叠状态保持,创建一个 group 并放入2个 tab->点击 header 折叠->重启->仍折叠；cmake --build build --config Debug；cd build；ctest -C Debug --output-on-failure
